{
  "$schema": "https://json-schema.org/draft/2020-12/schema",
  "type": "object",
  "properties": {
    "name": {
      "type": "string"
    },
    "slug": {
      "type": "string"
    },
    "generator": {
      "type": "string"
    },
    "generated": {
      "type": "string"
    },
    "confidence": {
      "type": "number"
    },
    "extends": {
      "type": "string"
    },
    "metadata": {
      "type": "object",
      "propertyNames": {
        "type": "string"
      },
      "additionalProperties": {}
    },
    "id": {
      "type": "string"
    },
    "source": {
      "type": "string",
      "enum": ["registry", "extraction", "llm", "unknown"]
    },
    "timestamp": {
      "type": "string"
    },
    "sources": {
      "type": "array",
      "items": {
        "type": "string"
      }
    },
    "observation": {
      "type": "object",
      "properties": {
        "personality": {
          "type": "array",
          "items": {
            "type": "string"
          }
        },
        "resembles": {
          "type": "array",
          "items": {
            "type": "string"
          }
        }
      },
      "additionalProperties": false
    },
    "decisions": {
      "type": "array",
      "items": {
        "type": "object",
        "properties": {
          "dimension": {
            "type": "string"
          },
          "dimension_kind": {
            "type": "string"
          },
          "embedding": {
            "type": "array",
            "items": {
              "type": "number"
            }
          }
        },
        "required": ["dimension"],
        "additionalProperties": false
      }
    },
    "rules": {
      "type": "array",
      "items": {
        "type": "object",
        "properties": {
          "id": {
            "type": "string"
          },
          "canonical": {
            "type": "string"
          },
          "kind": {
            "type": "string",
            "enum": [
              "color",
              "radius",
              "spacing",
              "type-size",
              "type-family",
              "type-weight",
              "shadow",
              "motion"
            ]
          },
          "summary": {
            "type": "string"
          },
          "pattern": {
            "type": "string"
          },
          "enforce_at": {
            "type": "array",
            "items": {
              "type": "string"
            }
          },
          "severity": {
            "type": "string",
            "enum": ["critical", "serious", "nit"]
          },
          "match": {
            "type": "string",
            "enum": ["exact", "band", "percent", "structural"]
          },
          "tolerance": {
            "type": "number"
          },
          "presence_floor": {
            "type": "integer",
            "minimum": 0,
            "maximum": 9007199254740991
          },
          "observed_count": {
            "type": "integer",
            "minimum": 0,
            "maximum": 9007199254740991
          },
          "support": {
            "type": "number",
            "minimum": 0,
            "maximum": 1
          },
          "rationale": {
            "type": "string"
          }
        },
        "required": ["id", "pattern"],
        "additionalProperties": false
      }
    },
    "palette": {
      "type": "object",
      "properties": {
        "dominant": {
          "type": "array",
          "items": {
            "type": "object",
            "properties": {
              "role": {
                "type": "string"
              },
              "value": {
                "type": "string"
              },
              "oklch": {
                "type": "array",
                "prefixItems": [
                  {
                    "type": "number"
                  },
                  {
                    "type": "number"
                  },
                  {
                    "type": "number"
                  }
                ]
              }
            },
            "required": ["role", "value"],
            "additionalProperties": false
          }
        },
        "neutrals": {
          "type": "object",
          "properties": {
            "steps": {
              "type": "array",
              "items": {
                "type": "string"
              }
            },
            "count": {
              "type": "number"
            }
          },
          "required": ["steps", "count"],
          "additionalProperties": false
        },
        "semantic": {
          "type": "array",
          "items": {
            "type": "object",
            "properties": {
              "role": {
                "type": "string"
              },
              "value": {
                "type": "string"
              },
              "oklch": {
                "type": "array",
                "prefixItems": [
                  {
                    "type": "number"
                  },
                  {
                    "type": "number"
                  },
                  {
                    "type": "number"
                  }
                ]
              }
            },
            "required": ["role", "value"],
            "additionalProperties": false
          }
        },
        "saturationProfile": {
          "type": "string",
          "enum": ["muted", "vibrant", "mixed"]
        },
        "contrast": {
          "type": "string",
          "enum": ["high", "moderate", "low"]
        }
      },
      "required": [
        "dominant",
        "neutrals",
        "semantic",
        "saturationProfile",
        "contrast"
      ],
      "additionalProperties": false
    },
    "spacing": {
      "type": "object",
      "properties": {
        "scale": {
          "type": "array",
          "items": {
            "type": "number"
          }
        },
        "regularity": {
          "type": "number"
        },
        "baseUnit": {
          "anyOf": [
            {
              "type": "number"
            },
            {
              "type": "null"
            }
          ]
        }
      },
      "required": ["scale", "regularity", "baseUnit"],
      "additionalProperties": false
    },
    "typography": {
      "type": "object",
      "properties": {
        "families": {
          "type": "array",
          "items": {
            "type": "string"
          }
        },
        "sizeRamp": {
          "type": "array",
          "items": {
            "type": "number"
          }
        },
        "weightDistribution": {
          "type": "object",
          "propertyNames": {
            "type": "string"
          },
          "additionalProperties": {
            "type": "number"
          }
        },
        "lineHeightPattern": {
          "type": "string",
          "enum": ["tight", "normal", "loose"]
        }
      },
      "required": [
        "families",
        "sizeRamp",
        "weightDistribution",
        "lineHeightPattern"
      ],
      "additionalProperties": false
    },
    "surfaces": {
      "type": "object",
      "properties": {
        "borderRadii": {
          "type": "array",
          "items": {
            "type": "number"
          }
        },
        "shadowComplexity": {
          "type": "string",
          "enum": ["deliberate-none", "subtle", "layered"]
        },
        "borderUsage": {
          "type": "string",
          "enum": ["minimal", "moderate", "heavy"]
        },
        "borderTokenCount": {
          "type": "number"
        }
      },
      "required": ["borderRadii", "shadowComplexity", "borderUsage"],
      "additionalProperties": false
    },
    "embedding": {
      "type": "array",
      "items": {
        "type": "number"
      }
    }
  },
  "required": [
    "id",
    "source",
    "timestamp",
    "palette",
    "spacing",
    "typography",
    "surfaces"
  ],
  "additionalProperties": false,
  "title": "Ghost Expression Frontmatter",
  "description": "Schema for YAML frontmatter in Ghost expression.md files."
}
