{
  "id": "ghost-ui",
  "source": "llm",
  "timestamp": "2026-04-14T12:52:50.477Z",
  "palette": {
    "dominant": [
      {
        "role": "primary",
        "value": "#1a1a1a",
        "oklch": [0.218, 0, 89.9]
      },
      {
        "role": "surface",
        "value": "#ffffff",
        "oklch": [1, 0, 89.9]
      },
      {
        "role": "secondary",
        "value": "#f5f5f5",
        "oklch": [0.97, 0, 89.9]
      },
      {
        "role": "accent",
        "value": "#1a1a1a",
        "oklch": [0.218, 0, 89.9]
      },
      {
        "role": "muted",
        "value": "#f0f0f0",
        "oklch": [0.955, 0, 89.9]
      },
      {
        "role": "inverse",
        "value": "#000000",
        "oklch": [0, 0, 0]
      }
    ],
    "neutrals": {
      "steps": [
        "#ffffff",
        "#f5f5f5",
        "#f0f0f0",
        "#e8e8e8",
        "#e5e5e5",
        "#cccccc",
        "#999999",
        "#666666",
        "#333333",
        "#232323",
        "#1a1a1a",
        "#000000"
      ],
      "count": 12
    },
    "semantic": [
      { "role": "surface", "value": "#ffffff", "oklch": [1, 0, 89.9] },
      { "role": "surface-alt", "value": "#f5f5f5", "oklch": [0.97, 0, 89.9] },
      { "role": "surface-muted", "value": "#f0f0f0", "oklch": [0.955, 0, 89.9] },
      { "role": "surface-dark", "value": "#0a0a0a", "oklch": [0.145, 0, 89.9] },
      { "role": "text", "value": "#1a1a1a", "oklch": [0.218, 0, 89.9] },
      { "role": "text-muted", "value": "#999999", "oklch": [0.683, 0, 89.9] },
      { "role": "text-alt", "value": "#666666", "oklch": [0.51, 0, 89.9] },
      { "role": "text-inverse", "value": "#ffffff", "oklch": [1, 0, 89.9] },
      { "role": "border", "value": "#e8e8e8", "oklch": [0.931, 0, 89.9] },
      { "role": "border-input", "value": "#e5e5e5", "oklch": [0.922, 0, 89.9] },
      { "role": "border-strong", "value": "#1a1a1a", "oklch": [0.218, 0, 89.9] },
      { "role": "danger", "value": "#f94b4b", "oklch": [0.661, 0.211, 25] },
      { "role": "success", "value": "#91cb80", "oklch": [0.784, 0.119, 138.8] },
      { "role": "warning", "value": "#fbcd44", "oklch": [0.866, 0.156, 89.6] },
      { "role": "info", "value": "#5c98f9", "oklch": [0.684, 0.157, 259.6] },
      { "role": "chart-1", "value": "#f6b44a", "oklch": [0.813, 0.142, 75.9] },
      { "role": "chart-2", "value": "#7585ff", "oklch": [0.663, 0.18, 274.8] },
      { "role": "chart-3", "value": "#d76a6a", "oklch": [0.653, 0.137, 21.6] },
      { "role": "chart-4", "value": "#d185e0", "oklch": [0.727, 0.151, 320.8] },
      { "role": "chart-5", "value": "#91cb80", "oklch": [0.784, 0.119, 138.8] }
    ],
    "saturationProfile": "muted",
    "contrast": "high"
  },
  "spacing": {
    "scale": [4, 6, 8, 12, 16, 20, 24, 32, 40, 48],
    "regularity": 0.95,
    "baseUnit": 4
  },
  "typography": {
    "families": [
      "system-ui, -apple-system, BlinkMacSystemFont, \"Segoe UI\", Roboto, sans-serif",
      "Geist Mono, monospace",
      "Cash Sans"
    ],
    "sizeRamp": [10, 12, 14, 16, 18, 20, 24, 30, 36, 48, 60, 72, 96, 128],
    "weightDistribution": {
      "300": 16,
      "400": 26,
      "500": 72,
      "600": 67,
      "700": 23,
      "900": 9
    },
    "lineHeightPattern": "tight"
  },
  "surfaces": {
    "borderRadii": [10, 14, 16, 20, 24, 999],
    "shadowComplexity": "subtle",
    "borderUsage": "heavy"
  },
  "embedding": [
    0.218, 0, 0.2497, 1, 0, 0.2497, 0.97, 0, 0.2497,
    0.218, 0, 0.2497, 1, 1, 0.6, 0.145, 1, 0.855,
    0.6098, 1, 1, 0.6919, 0.04, 0.48, 0.95, 0.125, 0.2,
    0.2835, 0.3306, 0.2273, 0.24, 0.6, 1, 0.1, 1,
    0.8682, 0, 1, 0.75, 1, 0.3, 1, 0.1563, 1,
    0.5, 1, 1, 0.3125, 1
  ]
}
